doc_id,original_text,processed_text
1,What is the step by step guide to invest in share market in india?,step step guid invest share market india
2,What is the step by step guide to invest in share market?,step step guid invest share market
3,What is the story of Kohinoor (Koh-i-Noor) Diamond?,stori kohinoor koh-i-noor diamond
4,What would happen if the Indian government stole the Kohinoor (Koh-i-Noor) diamond back?,would happen indian govern stole kohinoor koh-i-noor diamond back
5,How can I increase the speed of my internet connection while using a VPN?,increas speed internet connect use vpn
6,How can Internet speed be increased by hacking through DNS?,internet speed increas hack dn
7,Why am I mentally very lonely? How can I solve it?,mental lone solv
8,"Find the remainder when [math]23^{24}[/math] is divided by 24,23?",find remaind math /math divid
9,"Which one dissolve in water quikly sugar, salt, methane and carbon di oxide?",one dissolv water quikli sugar salt methan carbon di oxid
10,Which fish would survive in salt water?,fish would surviv salt water
11,Astrology: I am a Capricorn Sun Cap moon and cap rising...what does that say about me?,astrolog capricorn sun cap moon cap rise ... say
12,"I'm a triple Capricorn (Sun, Moon and ascendant in Capricorn) What does this say about me?",'m tripl capricorn sun moon ascend capricorn say
13,Should I buy tiago?,buy tiago
14,What keeps childern active and far from phone and video games?,keep childern activ far phone video game
15,How can I be a good geologist?,good geologist
16,What should I do to be a great geologist?,great geologist
17,When do you use シ instead of し?,use シ instead し
18,"When do you use ""&"" instead of ""and""?",use `` '' instead `` ''
19,Motorola (company): Can I hack my Charter Motorolla DCX3400?,motorola compani hack charter motorolla dcx
20,How do I hack Motorola DCX3400 for free internet?,hack motorola dcx free internet
21,Method to find separation of slits using fresnel biprism?,method find separ slit use fresnel biprism
22,What are some of the things technicians can tell about the durability and reliability of Laptops and its components?,thing technician tell durabl reliabl laptop compon
23,How do I read and find my YouTube comments?,read find youtub comment
24,How can I see all my Youtube comments?,see youtub comment
25,What can make Physics easy to learn?,make physic easi learn
26,How can you make physics easy to learn?,make physic easi learn
27,What was your first sexual experience like?,first sexual experi like
28,What was your first sexual experience?,first sexual experi
29,"What are the laws to change your status from a student visa to a green card in the US, how do they compare to the immigration laws in Canada?",law chang statu student visa green card u compar immigr law canada
30,What are the laws to change your status from a student visa to a green card in the US? How do they compare to the immigration laws in Japan?,law chang statu student visa green card u compar immigr law japan
31,What would a Trump presidency mean for current international master’s students on an F1 visa?,would trump presid mean current intern master ’ student f visa
32,How will a Trump presidency affect the students presently in US or planning to study in US?,trump presid affect student present u plan studi u
33,What does manipulation mean?,manipul mean
34,What does manipulation means?,manipul mean
35,Why do girls want to be friends with the guy they reject?,girl want friend guy reject
36,How do guys feel after rejecting a girl?,guy feel reject girl
37,Why are so many Quora users posting questions that are readily answered on Google?,mani quora user post question readili answer googl
38,Why do people ask Quora questions which can be answered easily by Google?,peopl ask quora question answer easili googl
39,Which is the best digital marketing institution in banglore?,best digit market institut banglor
40,Which is the best digital marketing institute in Pune?,best digit market institut pune
41,Why do rockets look white?,rocket look white
42,Why are rockets and boosters painted white?,rocket booster paint white
43,What's causing someone to be jealous?,'s caus someon jealou
44,What can I do to avoid being jealous of someone?,avoid jealou someon
45,What are the questions should not ask on Quora?,question ask quora
47,How much is 30 kV in HP?,much kv hp
48,Where can I find a conversion chart for CC to horsepower?,find convers chart cc horsepow
49,What does it mean that every time I look at the clock the numbers are the same?,mean everi time look clock number
50,How many times a day do a clock’s hands overlap?,mani time day clock ’ hand overlap
51,What are some tips on making it through the job interview process at Medicines?,tip make job interview process medicin
52,What are some tips on making it through the job interview process at Foundation Medicine?,tip make job interview process foundat medicin
53,What is web application?,web applic
54,What is the web application framework?,web applic framework
55,Does society place too much importance on sports?,societi place much import sport
56,How do sports contribute to the society?,sport contribut societi
57,What is best way to make money online?,best way make money onlin
58,What is best way to ask for money online?,best way ask money onlin
59,How should I prepare for CA final law?,prepar ca final law
60,How one should know that he/she completely prepare for CA final exam?,one know he/sh complet prepar ca final exam
61,What's one thing you would like to do better?,'s one thing would like better
62,What's one thing you do despite knowing better?,'s one thing despit know better
63,What are some special cares for someone with a nose that gets stuffy during the night?,special care someon nose get stuffi night
64,How can I keep my nose from getting stuffy at night?,keep nose get stuffi night
65,What Game of Thrones villain would be the most likely to give you mercy?,game throne villain would like give merci
66,What Game of Thrones villain would you most like to be at the mercy of?,game throne villain would like merci
67,"Does the United States government still blacklist (employment, etc.) some United States citizens because their political views?",unit state govern still blacklist employ etc unit state citizen polit view
68,How is the average speed of gas molecules determined?,averag speed ga molecul determin
69,What is the best travel website in spain?,best travel websit spain
70,What is the best travel website?,best travel websit
71,Why do some people think Obama will try to take their guns away?,peopl think obama tri take gun away
72,Has there been a gun control initiative to take away guns people already own?,gun control initi take away gun peopl alreadi
73,I'm a 19-year-old. How can I improve my skills or what should I do to become an entrepreneur in the next few years?,'m -year-old improv skill becom entrepreneur next year
74,I am a 19 year old guy. How can I become a billionaire in the next 10 years?,year old guy becom billionair next year
75,"When a girlfriend asks her boyfriend ""Why did you choose me? What makes you want to be with me?"", what should one reply to her?",girlfriend ask boyfriend `` choos make want `` one repli
76,My girlfriend said that we should end this because she is confused about her feelings for me. I wished her well and disconnected. Should I call her and ask her if she wants to get back together?,girlfriend said end confus feel wish well disconnect call ask want get back togeth
77,How do we prepare for UPSC?,prepar upsc
78,How do I prepare for civil service?,prepar civil servic
79,What is the stall speed and AOA of an f-14 with wings fully swept back?,stall speed aoa f- wing fulli swept back
80,"Why did aircraft stop using variable-sweep wings, like those on an F-14?",aircraft stop use variable-sweep wing like f-
81,Why do Slavs squat?,slav squat
82,Will squats make my legs thicker?,squat make leg thicker
83,When can I expect my Cognizant confirmation mail?,expect cogniz confirm mail
84,When can I expect Cognizant confirmation mail?,expect cogniz confirm mail
85,"Can I make 50,000 a month by day trading?",make month day trade
86,"Can I make 30,000 a month by day trading?",make month day trade
87,Is being a good kid and not being a rebel worth it in the long run?,good kid rebel worth long run
88,Is being bored good for a kid?,bore good kid
89,What universities does Rexnord recruit new grads from? What majors are they looking for?,univers rexnord recruit new grad major look
90,What universities does B&G Foods recruit new grads from? What majors are they looking for?,univers b g food recruit new grad major look
91,What is the quickest way to increase Instagram followers?,quickest way increas instagram follow
92,How can we increase our number of Instagram followers?,increas number instagram follow
93,How did Darth Vader fought Darth Maul in Star Wars Legends?,darth vader fought darth maul star war legend
94,Does Quora have a character limit for profile descriptions?,quora charact limit profil descript
95,"What are the stages of breaking up between couple? I mean, what happens after the breaking up emotionally whether its a male or female?",stage break coupl mean happen break emot whether male femal
96,"Who is affected more by a breakup, the boy or the girl?",affect breakup boy girl
97,What are some examples of products that can be make from crude oil?,exampl product make crude oil
98,What are some of the products made from crude oil?,product made crude oil
99,How do I make friends.,make friend
100,How to make friends ?,make friend
101,Is Career Launcher good for RBI Grade B preparation?,career launcher good rbi grade b prepar
102,How is career launcher online program for RBI Grade B?,career launcher onlin program rbi grade b
103,"Will a Blu Ray play on a regular DVD player? If so, how?",blu ray play regular dvd player
104,How can you play a Blu Ray DVD on a regular DVD player?,play blu ray dvd regular dvd player
105,Nd she is always sad?,nd alway sad
106,Aerodynamically what happens when propellor rotates?,aerodynam happen propellor rotat
107,What is the best/most memorable thing you've ever eaten and why?,best/most memor thing 've ever eaten
108,What is the most delicious dish you've ever eaten and why?,delici dish 've ever eaten
109,How GST affects the CAs and tax officers?,gst affect ca tax offic
110,Why can't I do my homework?,ca n't homework
111,How difficult is it get into RSI?,difficult get rsi
112,Do you apply for programs like RSI when you're a rising senior?,appli program like rsi 're rise senior
113,Who is israil friend?,israil friend
114,Is my boyfriend lying about his true feelings for his friend and is he secretly attracted to her?,boyfriend lie true feel friend secretli attract
115,What are some good rap songs to dance to?,good rap song danc
116,What are some of the best rap songs?,best rap song
117,I was suddenly logged off Gmail. I can't remember my Gmail password and just realized the recovery email is no longer alive. What can I do?,suddenli log gmail ca n't rememb gmail password realiz recoveri email longer aliv
118,I can't remember my Gmail password or my recovery email. How can I recover my e-mail?,ca n't rememb gmail password recoveri email recov e-mail
119,What are the best ways to learn French?,best way learn french
120,How do I learn french genders?,learn french gender
121,How do I download content from a kickass torrent without registration?,download content kickass torrent without registr
122,Is Kickass Torrents trustworthy?,kickass torrent trustworthi
123,Is it normal to have a dark ring around the iris of my eye?,normal dark ring around iri eye
124,What causes a dark ring around the iris? How should it be treated?,caus dark ring around iri treat
125,How is the new Harry Potter book 'Harry Potter and the Cursed Child'?,new harri potter book 'harri potter cur child
126,How bad is the new book by J.K Rowling?,bad new book j.k rowl
127,Why do I always get depressed?,alway get depress
128,Why do I always get depressed in the evening?,alway get depress even
129,Where can I find a European family office database?,find european famili offic databas
130,Where do I find a U.S. family office database?,find u.s. famili offic databas
131,What is Java programming? How To Learn Java Programming Language ?,java program learn java program languag
132,How do I learn a computer language like java?,learn comput languag like java
133,What is the best book ever made?,best book ever made
134,What is the most important book you have ever read?,import book ever read
135,Can we ever store energy produced in lightning?,ever store energi produc lightn
136,Is it possible to store the energy of lightning?,possibl store energi lightn
137,What is your review of Performance Testing?,review perform test
138,What is performance testing?,perform test
139,At what cost does so much privacy as in Germany come? What else is lost to gain so much privacy?,cost much privaci germani come el lost gain much privaci
140,Are there any people who genuinely enjoy salad with no dressing?,peopl genuin enjoy salad dress
141,What are the types of immunity?,type immun
142,What are the different types of immunity in our body?,differ type immun bodi
143,What is a narcissistic personality disorder?,narcissist person disord
144,What is narcissistic personality disorder?,narcissist person disord
145,How I can speak English fluently?,speak english fluentli
146,How can I learn to speak English fluently?,learn speak english fluentli
147,How helpful is QuickBooks' auto data recovery support phone number to recover your corrupted data files?,help quickbook auto data recoveri support phone number recov corrupt data file
148,What is the quickbooks customer support phone number USA?,quickbook custom support phone number usa
149,Who is the richest gambler of all time and how can I reach his level?,richest gambler time reach level
150,Who is the richest gambler of all time and how can I reach his level as a gambler?,richest gambler time reach level gambler
151,If I fire a bullet backward from an aircraft going faster than the bullet; will the bullet be going backwards?,fire bullet backward aircraft go faster bullet bullet go backward
152,"Do bullets travel faster than the speed of sound when shot from a gun? If not, is it possible? If they do, what gun and how much devastation occurs?",bullet travel faster speed sound shot gun possibl gun much devast occur
153,How do I prevent breast cancer?,prevent breast cancer
154,Is breast cancer preventable?,breast cancer prevent
155,How do I log out of my Gmail account on my friend's phone?,log gmail account friend 's phone
156,How can I know who logged in to my Gmail account? (by telling his IP address or device name)?,know log gmail account tell ip address devic name
157,How can I make money through the Internet?,make money internet
158,"What are some different ways to make money online, excluding selling things?",differ way make money onlin exclud sell thing
159,What is purpose of life?,purpos life
160,What's the purpose of life? What is life actually about?,'s purpos life life actual
161,When will the BJP government strip all the Muslims and the Christians of the Indian citizenship and put them on boats like the Rohingya's of Burma?,bjp govern strip muslim christian indian citizenship put boat like rohingya 's burma
162,"Why India does not apply the ""Burma-Rohingya model"" to deport illegal Bangladeshis?",india appli `` burma-rohingya model '' deport illeg bangladeshi
163,What is the right etiquette for wishing a Jehovah Witness happy birthday?,right etiquett wish jehovah wit happi birthday
164,How important is it to be the first person to wish someone a happy birthday?,import first person wish someon happi birthday
165,"If someone wants to open a commercial FM radio station in any city of India, how much does it cost and what is the procedure?",someon want open commerci fm radio station citi india much cost procedur
166,"I want to make a travel commercial/clip video HD , For India and New Zealand. How much will it cost?",want make travel commercial/clip video hd india new zealand much cost
167,Why do Swiss despise Asians?,swiss despis asian
168,Why do technical employees despise sales people so much?,technic employe despis sale peopl much
169,What are some of the high salary income jobs in the field of biotechnology?,high salari incom job field biotechnolog
170,What are some high paying jobs for a fresher with an M.Tech in biotechnology?,high pay job fresher m.tech biotechnolog
171,How can I increase my height after 21 also?,increas height also
172,Can height increase after 25?,height increas
173,"What were the major effects of the cambodia earthquake, and how do these effects compare to the Kamchatca earthquakes in 1952?",major effect cambodia earthquak effect compar kamchatca earthquak
174,"What were the major effects of the cambodia earthquake, and how do these effects compare to the Valparaiso earthquake in 1822?",major effect cambodia earthquak effect compar valparaiso earthquak
175,What is the difference between sincerity and fairness?,differ sincer fair
176,What's the difference between honest and sincere?,'s differ honest sincer
177,Which is the best gaming laptop under 60k INR?,best game laptop k inr
178,Which is the best gaming laptop under Rs 60000?,best game laptop r
179,What is your review of The Next Warrior: Proving Grounds - Part 9?,review next warrior prove ground part
180,What is your review of The Next Warrior: Proving Grounds - Part 5?,review next warrior prove ground part
181,What is the best reference book for physics class 11th?,best refer book physic class th
182,"Which book should I choose for reference for physics and chemistry (class 11, CBSE board)?",book choos refer physic chemistri class cbse board
183,"National Institute of Technology, Kurukshetra: How is the social life at NITK, Surathkal?",nation institut technolog kurukshetra social life nitk surathk
184,"National Institute of Technology Karnataka (NITK) , Surathkal: To the graduating batch: What lessons would you want to give to your juniors before you leave?",nation institut technolog karnataka nitk surathk graduat batch lesson would want give junior leav
185,What are some of the best romantic movies in English?,best romant movi english
186,What is the best romantic movie you have ever seen?,best romant movi ever seen
188,What causes nightmares that seem real?,caus nightmar seem real
189,What is abstract expressionism in painting?,abstract expression paint
190,What are some of the major influences of abstract expressionism?,major influenc abstract expression
191,How does 3D printing work?,print work
192,How do 3D printing work?,print work
193,What was it like to attend Caltech with Jeremy Ehrhardt?,like attend caltech jeremi ehrhardt
194,Who are some notable folks who attended Caltech?,notabl folk attend caltech
195,Why did harry become a horcrux?,harri becom horcrux
196,What is a Horcrux?,horcrux
197,What are the best associate product manager (APM) programs that someone in their early 20s can join to learn product management and have a rewarding career in the company?,best associ product manag apm program someon earli join learn product manag reward career compani
198,What are the general requirement to become a Product Manager or a Program Manager in a product based software company?,gener requir becom product manag program manag product base softwar compani
199,Why is the number for Skype at 1-855-425-3768 always busy?,number skype -- alway busi
200,How could I get Skype to work on an android 4.1.1 phone?,could get skype work android .. phone
201,Will there really be any war between India and Pakistan over the Uri attack? What will be its effects?,realli war india pakistan uri attack effect
202,Will there be a nuclear war between India and Pakistan?,nuclear war india pakistan
203,Did Ronald Reagan have a mannerism in his speech?,ronald reagan manner speech
204,How did Ronald Reagan react to 9/11?,ronald reagan react
205,What were the war strategies of the Union and the Confederates during the Civil War?,war strategi union confeder civil war
206,How could the Confederates have possibly defeated Union forces at Gettysburg during the American Civil War?,could confeder possibl defeat union forc gettysburg american civil war
207,Which is the best fiction novel of 2016?,best fiction novel
208,Which are some of the best fiction novels?,best fiction novel
209,Can I recover my email if I forgot the password?,recov email forgot password
210,What should I do if I forgot my email password?,forgot email password
211,Will the recent demonetisation results in higher GDP? If so how much?,recent demonetis result higher gdp much
212,How demonetisation could affect the GDP of India in both short run and long run?,demonetis could affect gdp india short run long run
213,Have you ever heard of travel hacking?,ever heard travel hack
214,Can WhatsApp be hacked?,whatsapp hack
215,What's the difference between love and pity?,'s differ love piti
216,What is the difference between love and pity?,differ love piti
217,How competitive is the hiring process at Republic Bank?,competit hire process republ bank
218,How competitive is the hiring process at S & T Bank?,competit hire process bank
219,How Google helps in spam ranking adjustment of the search results?,googl help spam rank adjust search result
220,"What is the distribution of traffic between Google organic search results? e.g. #1 vs. #2 in rankings, first page vs. second page",distribut traffic googl organ search result e.g vs. rank first page vs. second page
221,Where can I watch gonulcelen with english subtitles?,watch gonulcelen english subtitl
222,Where can I watch sarrainodu with subtitles?,watch sarrainodu subtitl
223,Is USA the most powerful country of the world?,usa power countri world
224,Why is the USA the most powerful country of the world?,usa power countri world
225,How do you obtain an instant ulcer pain relief?,obtain instant ulcer pain relief
226,What is better for a low back pain: heat or ice?,better low back pain heat ice
227,What do you think China food?,think china food
228,How do you think of Chinese food?,think chine food
229,What does taking advantage of someone mean?,take advantag someon mean
230,Is it worse to take advantage of someone or be materialistic?,wors take advantag someon materialist
231,Why do we cry when we are happy and when we are sad?,cri happi sad
232,Why do we cry?,cri
233,Why do some girls like to stick their their tongues out when taking pictures?,girl like stick tongu take pictur
234,Why do teen girls (and women in general) allow their boyfriends to take naked pictures of them in this day and (digital) age?,teen girl woman gener allow boyfriend take nake pictur day digit age
235,"Did you find the ending of the novel ""1984"" depressing?",find end novel `` '' depress
236,"How do Winston and Julia differ in the novel ""1984""? How are they similar?",winston julia differ novel `` '' similar
237,What are some mind-blowing computer tools that exist that most people don't know about?,mind-blow comput tool exist peopl n't know
238,What are some mind-blowing technologies that exist that most people don't know about?,mind-blow technolog exist peopl n't know
239,Should the toothbrush be wet or dry before applying the toothpaste?,toothbrush wet dri appli toothpast
240,What is the cheapest toothpaste?,cheapest toothpast
241,Why my question was marked as needing imrovement?,question mark need imrov
242,How can I ask a question without getting marked as ‘need to improve’?,ask question without get mark ‘ need improv ’
243,What is the difference between a neutral state and a buffer state?,differ neutral state buffer state
244,"If every state of the USA declared war against each other, which would win?",everi state usa declar war would win
245,What mineral holds the highest electrical charge?,miner hold highest electr charg
246,What mineral can hold the greatest electrical charge?,miner hold greatest electr charg
247,What is the greatest mystery in the universe?,greatest mysteri univers
248,What is the greatest mystery of all time?,greatest mysteri time
249,What is the alternative to machine learning?,altern machin learn
250,How do I over-sample a multi-class imbalance data set?,over-sampl multi-class imbal data set
251,"Why does China block sanctions at the UN against the Jaish-e-Mohammad (JeM) chief, Masood Azhar?",china block sanction un jaish-e-mohammad jem chief masood azhar
252,Why does China support Masood Azhar?,china support masood azhar
253,What is the mean of future budget?,mean futur budget
254,What is the meaning of the future?,mean futur
255,Can excessive amounts of Vitamin C cause me to have a miscarriage?,excess amount vitamin c caus miscarriag
256,How can Vitamin C cause a miscarriage?,vitamin c caus miscarriag
257,What is it like to work in Asahi India Glass? What will be the pay scale after one or two years?,like work asahi india glass pay scale one two year
258,When will we get the Call Letter after we get the Letter of Intent in Asahi India Glass recruitment?,get call letter get letter intent asahi india glass recruit
259,How do I access Torbox in India?,access torbox india
260,How do I access Google.com from India?,access google.com india
261,What are some yakshini mantras?,yakshini mantra
262,What is a Yantra & Mantra?,yantra mantra
263,Was six party talks successful?,six parti talk success
264,Which course is better in NICMAR?,cours better nicmar
265,How do I register my domain site email?,regist domain site email
266,How do you register a .an domain?,regist .an domain
267,Is it normal for older men to be attracted to young women?,normal older men attract young woman
268,Why am I attracted to older men?,attract older men
