doc_id,original_text,processed_text
269,What is the strongest structure or strongest shape under compression?,strongest structur strongest shape compress
270,What is the strongest Kevlar cord?,strongest kevlar cord
271,Who are the Rohingya Muslims?,rohingya muslim
272,Who are the Rohingya people?,rohingya peopl
274,Does it matter whether humanity is evil or not?,matter whether human evil
275,Are exocytosis and endocytosis examples of active or passive transport?,exocytosi endocytosi exampl activ passiv transport
276,What are examples of passive transport in cells?,exampl passiv transport cell
277,How i get hair on bald head?,get hair bald head
278,"If I shave my head for 2 years as am getting bald and then grew my hair, will the hair will be same as when I intially have? Or I loose more hair?",shave head year get bald grew hair hair intial loo hair
279,What is the ideal life after retirement?,ideal life retir
280,What's life after retirement?,'s life retir
281,What is our stance against Pakistan?,stanc pakistan
282,What is the stance of Pakistan in the possession of weapons of mass destruction by North korea? Does it support DPRK or is it against DPRK?,stanc pakistan possess weapon mass destruct north korea support dprk dprk
283,What are good websites for escorts?,good websit escort
284,How do I find a good escort?,find good escort
285,Which one is better polo diesel or grand i10 petrol?,one better polo diesel grand petrol
286,What is the best diet for a growing decathlete?,best diet grow decathlet
287,Does a black hole have mass?,black hole mass
288,Does a black hole have a finite mass?,black hole finit mass
289,"Is Morgan Freeman correct when he says the only way to stop racism, is to stop talking about it?",morgan freeman correct say way stop racism stop talk
290,What are your views about this Morgan Freeman quote about Racism?,view morgan freeman quot racism
291,Does Fab currently offer new employees stock options or RSUs?,fab current offer new employe stock option rsu
292,Does Uber currently offer new employees stock options or RSUs?,uber current offer new employe stock option rsu
293,How would you review the site Waveclues?,would review site waveclu
294,Is there a good pay for reviews site out there?,good pay review site
295,In how many ways can we distribute 10 identical looking pencils to 4 students so that each student gets at least one pencil?,mani way distribut ident look pencil student student get least one pencil
296,In how many ways 12 apples can be distributed among 4 children such that every child gets at least 2 apples?,mani way appl distribut among child everi child get least appl
297,How much would it cost to hire Jerry Seinfeld for 1-2 hours?,much would cost hire jerri seinfeld hour
298,How much on average would it cost to video tape a 2 hour presentation?,much averag would cost video tape hour present
299,Is 7 days too late for rabies vaccine after a possible non-bite exposure?,day late rabi vaccin possibl non-bit exposur
300,Can I take rabies injection after 1 day of dog bite?,take rabi inject day dog bite
301,How many years Britain ruled India?,mani year britain rule india
302,What is the standard amount of time off given for an international relocation?,standard amount time given intern reloc
303,How can I stop being afraid of working?,stop afraid work
304,How do you stop being afraid of everything?,stop afraid everyth
305,Why does Red keep the keys in OITNB?,red keep key oitnb
306,Why does Red keep the keys in season 4 of Orange is the New Black?,red keep key season orang new black
307,At what age should someone lose their virginity?,age someon lose virgin
308,"At what age, how, and where did you lose your virginity?",age lose virgin
309,How forgetful are you?,forget
310,How can I forget my wife?,forget wife
311,Could Snoke secretly be Darth Maul?,could snoke secretli darth maul
312,How could Snoke be Darth Plagueis if he was killed by Emperor Palpatine?,could snoke darth plaguei kill emperor palpatin
314,How do you upload movies on YouTube and monetize them? Is there any issue of copyright,upload movi youtub monet issu copyright
315,Would you switch from Canon 6D to Leica D-LUX 109?,would switch canon leica d-lux
316,What tripod should I get for my Canon 6D?,tripod get canon
317,What does the Quora website look like to members of Quora moderation?,quora websit look like member quora moder
319,Why nobody answer my questions in Quora?,nobodi answer question quora
320,Why is no one answering my questions in Quora?,one answer question quora
321,What is the funniest joke you know?,funniest joke know
322,What is the funniest joke of all time?,funniest joke time
323,"I got job offer @ Chelmsford-Essex, London with £3764 PM pay-after tax deduction. Pls advice tentative monthly expenses for couple? & saving possible?",got job offer chelmsford-essex london £ pm pay-aft tax deduct pl advic tent monthli expens coupl save possibl
324,"If I am leaving Norway, can I pay down my mortgage with my BSU account, and then sell my apartment without having to pay back the tax deduction I got for having BSU?",leav norway pay mortgag bsu account sell apart without pay back tax deduct got bsu
325,What are stereotypes about the United Kingdom?,stereotyp unit kingdom
326,What do Americans think about the United Kingdom?,american think unit kingdom
327,How do I use Twitter as a business source?,use twitter busi sourc
328,How can I use Twitter for business?,use twitter busi
329,How can I transfer money from Skrill to a PayPal account?,transfer money skrill paypal account
330,How can I send money from my PayPal account to my Skrill account to withdraw?,send money paypal account skrill account withdraw
331,Which is the best earphone with deep bass under 1000?,best earphon deep bass
332,Which is the Best earphones under Rs 1000?,best earphon r
333,Are government employees eligible to Sukanya Samrudi Yojana?,govern employe elig sukanya samrudi yojana
334,Can a Government employee apply IEC?,govern employe appli iec
335,Which is correct - 'Looking forward to speak with you' or 'Look forward to speak with you'?,correct 'look forward speak 'look forward speak
336,"Which is correct: ""speak with"" or ""speak to""?",correct `` speak '' `` speak ''
337,Which are the best engineering fields?,best engin field
338,What is the best field of engineering?,best field engin
339,How do you make life suit you and stop life from abusing you mentally and emotionally?,make life suit stop life abus mental emot
340,"Why are emotionally abusive people in my life? Several ex boyfriends, friends, and past coworkers/bosses have been abusers. Do I attract them?",emot abus peopl life sever ex boyfriend friend past coworkers/boss abus attract
341,What is the difference between gross salary and CTC?,differ gross salari ctc
342,"There seems to be a difference between my weekly paycheck and the yearly salary my employer agreed upon, how does that work?",seem differ weekli paycheck yearli salari employ agre upon work
343,Which are the prospering towns in Kerala?,prosper town kerala
344,Why are there so many Christians in Kerala?,mani christian kerala
345,What is the best way to gain confidence?,best way gain confid
346,How can I speak with more clarity and confidence?,speak clariti confid
347,Does anyone see the relation between Greek gods and Hindu gods?,anyon see relat greek god hindu god
348,"What parallelism can we draw between gods of Hindu mythology, Greek mythology, Egyptian mythology, etc.?",parallel draw god hindu mytholog greek mytholog egyptian mytholog etc
349,How do I switch from Apple Music to Spotify?,switch appl music spotifi
350,Should I switch from Spotify to Apple Music?,switch spotifi appl music
351,Which is the best fixed income fund?,best fix incom fund
352,What is the best fixed income fund?,best fix incom fund
353,What is it like to live in Cologne?,like live cologn
354,"What is it like to live in Köln, Germany?",like live köln germani
355,"Between Robert De Niro and Al Pacino, who is more successful?",robert de niro al pacino success
356,"Who do you regard as the best actor, Robert De Niro or Al Pacino?",regard best actor robert de niro al pacino
357,Why does some people prefer small families.?,peopl prefer small famili
358,Why do some people prefer to live with small family?,peopl prefer live small famili
360,Do animals (besides humans) kiss?,anim besid human kiss
361,How do you get deleted Instagram chats?,get delet instagram chat
362,How can I view deleted Instagram dms?,view delet instagram dm
363,How can I stop being addicted to love?,stop addict love
364,How do I stop being addicted to someone?,stop addict someon
365,What if I hired two private eyes and ordered them to follow each other?,hire two privat eye order follow
366,Would I be able to hire two private investigators and then get them to follow each other?,would abl hire two privat investig get follow
367,How do I find a startup accelerator?,find startup acceler
368,How do startup accelerators give you the funding?,startup acceler give fund
369,How can I check wifi history and access it through android phones?,check wifi histori access android phone
370,I cannot open Quora through my WiFi router. Why can I only access it through a mobile network?,open quora wifi router access mobil network
371,"What was the significance of the battle of Somme, and how did this battle compare and contrast to the Battle of Rostov?",signific battl somm battl compar contrast battl rostov
372,"What was the significance of the battle of Somme, and how did this battle compare and contrast to the Battle of Riyadh?",signific battl somm battl compar contrast battl riyadh
373,What is the most creative college admissions essay you've read?,creativ colleg admiss essay 've read
374,Has any college admission officer cried in public while reading an applicant's essay?,colleg admiss offic cri public read applic 's essay
375,"What would happen if you cover one of your eyes with an eye patch for one year, then take the patch off?",would happen cover one eye eye patch one year take patch
376,What happens if eye medicine enters the eye?,happen eye medicin enter eye
377,Is it possible to pursue many different things in life?,possibl pursu mani differ thing life
380,"No fanboys please, but who was the true batman, Christian Bale or Ben Affleck?",fanboy plea true batman christian bale ben affleck
381,Which business is good start up in Hyderabad?,busi good start hyderabad
382,Which business is better to start in Hyderabad?,busi better start hyderabad
383,How can I stop being so possessive?,stop possess
384,How do I stop being over possessive for a person whom I love?,stop possess person love
385,Who was the wife of Lord Krishna?,wife lord krishna
386,Who is the father of lord Krishna?,father lord krishna
387,What is the best combination of courses I can take up along with CA to enhance my career?,best combin cours take along ca enhanc career
388,What courses must be taken along with CA course?,cours must taken along ca cours
389,How do you take a screenshot on a Mac laptop?,take screenshot mac laptop
390,How do I take a screenshot on my MacBook Pro? What are some instructions?,take screenshot macbook pro instruct
391,What is the work of an executive recruiter like?,work execut recruit like
392,What is it like to work with an executive recruiter?,like work execut recruit
393,Which psychological need does 'collecting' fulfill?,psycholog need 'collect fulfil
394,Why do people collect things?,peopl collect thing
395,What are some must watch TV shows before you die?,must watch tv show die
396,Are there any must watch TV shows?,must watch tv show
397,How can I become more fluent in Chinese?,becom fluent chine
398,How can I become fluent in chinese?,becom fluent chine
400,What will be the impact of scrapping of ₹500 and ₹1000 rupee notes on the real estate market?,impact scrap ₹ ₹ rupe note real estat market
401,What is the easiest way to become a billionaire($)?,easiest way becom billionair
402,What is the best way to become a billionaire?,best way becom billionair
403,Are there People who are willing to give free lectures or conduct free workshop in India colleges?,peopl will give free lectur conduct free workshop india colleg
404,"Almost two weeks in on Prozac, why do I still feel antisocial and still don't want to go to events? Why does my social behavior and mood change daily?",almost two week prozac still feel antisoci still n't want go event social behavior mood chang daili
405,What's the best way to start learning robotics?,'s best way start learn robot
406,What is the best way to start robotics? Which is the best development board that I can start working on it?,best way start robot best develop board start work
407,Why do people hate Hillary Clinton?,peopl hate hillari clinton
408,What are the reasons that people dislike Hillary Clinton?,reason peopl dislik hillari clinton
409,Why are women who are on their periods are regarded as 'unclean' such that they are prevented in taking an actived part in rituals (Hinduism)?,woman period regard 'unclean prevent take activ part ritual hinduism
410,"Why is it always expected that a woman should take care of housework, children and cooking (especially in Indian culture)? Are these activities the responsibility of women alone? Why do men not share equally in such work?",alway expect woman take care housework child cook especi indian cultur activ respons woman alon men share equal work
411,"If atheism is the lack of belief in gods, what is the term for the belief that there is no god?",atheism lack belief god term belief god
412,"Is atheism the lack of belief in gods, or a claim that god does not exist?",atheism lack belief god claim god exist
413,What is it like to be Jack Dorsey?,like jack dorsey
414,What is Jack Dorsey like?,jack dorsey like
415,What are the best quotes/lessons of the Assassin's Creed series?,best quotes/lesson assassin 's creed seri
416,Which assassin has the best robes in Assassin's Creed?,assassin best robe assassin 's creed
417,"Do inkjet printers use color ink when printing black and white documents? If so, why?",inkjet printer use color ink print black white document
418,"If CMYK printers create black by using colored ink and only complementing with black ink, why do shops charge more for color prints?",cmyk printer creat black use color ink complement black ink shop charg color print
419,Why is creativity important?,creativ import
421,If Hillary Clinton could not continue her Presidential campaign how would the Democratic Party choose a new candidate?,hillari clinton could continu presidenti campaign would democrat parti choos new candid
422,If Hillary Clinton can no longer serve as the Democratic nominee how would her successor be chosen?,hillari clinton longer serv democrat nomine would successor chosen
423,How headphones work as an Antenna to play FM radio channels on Mobile phones? Why mobile companies doesn't install the same inbuilt Antenna on phones to be able to play FM without the headphones?,headphon work antenna play fm radio channel mobil phone mobil compani n't instal inbuilt antenna phone abl play fm without headphon
424,Why don't phones have a built-in FM antenna?,n't phone built-in fm antenna
425,What are the best career growth technologies for automation engineers apart from automation tools?,best career growth technolog autom engin apart autom tool
426,Himalayan or Duke KTM 200 for touring?,himalayan duke ktm tour
427,What are the disadvantages of listing a company in NSE?,disadvantag list compani nse
428,What are the benefits of listing a company in NSE?,benefit list compani nse
429,How many derivatives of an object's position with respect to time have to be continuous?,mani deriv object 's posit respect time continu
430,When does drawing become fun?,draw becom fun
431,Is the neutron star made up of?,neutron star made
432,Is the neutron star made up of only neutrons?,neutron star made neutron
433,I got a 3.8 GPA. Is it enough to get into top universities like Harvard?,got gpa enough get top univers like harvard
434,Is a 3.8 GPA sufficient to get into a top school?,gpa suffici get top school
435,What is a profitable way to trade binary options?,profit way trade binari option
436,What is binary options trading?,binari option trade
437,How do I utilize free time to avoid depression?,util free time avoid depress
438,Can a person graduating from IIMs like LIK and even the new IIMs like Ranchi and Trichy ever catch up to the graduates from ABC and get a similar package?,person graduat iim like lik even new iim like ranchi trichi ever catch graduat abc get similar packag
439,How can I learn computer security?,learn comput secur
440,How can I get started to learn information security?,get start learn inform secur
441,How do I earn from Quora?,earn quora
442,Can I earn money on Quora?,earn money quora
443,What is my puk code?,puk code
444,What's the PUK for TF64SIMC4?,'s puk tfsimc
445,How can I find job in Japan?,find job japan
446,How can I find an IT job in Japan?,find job japan
447,"What are some examples of sentences using the word ""hysteria""?",exampl sentenc use word `` hysteria ''
448,What is the best home wireless network setup and expected speeds?,best home wireless network setup expect speed
449,Will there be another billion dollar lottery Jackpot?,anoth billion dollar lotteri jackpot
450,When will the lottery reach the next billion dollar jackpot?,lotteri reach next billion dollar jackpot
451,How scary is it to drive on the road to Hana given all of the turns?,scari drive road hana given turn
452,Do I need a four-wheel-drive car to drive all the way on the Road to Hana?,need four-wheel-dr car drive way road hana
453,How do I create a new shell in a new terminal using C programming (Linux terminal)?,creat new shell new termin use c program linux termin
454,How do I create a new Terminal and new shell in Linux using C programming?,creat new termin new shell linux use c program
455,Does cognition affect perception?,cognit affect percept
456,Does cognitive strain affect digestion?,cognit strain affect digest
457,How TQWL is different from CKWL (Tatkal waiting list)?,tqwl differ ckwl tatkal wait list
458,I have made a railway reservation but got it on the Tatkal waiting list. Will I get a refund if I cancel it?,made railway reserv got tatkal wait list get refund cancel
459,How can we make the world a better place to live in for the future generations?,make world better place live futur gener
460,What can I do to make the world a better place?,make world better place
461,How many Champions are there in League of Legends?,mani champion leagu legend
462,Who is the best LoL (League of Legends) champion?,best lol leagu legend champion
463,Is drinking 4 liters of water each day unhealthy?,drink liter water day unhealthi
464,How many liters of water should I drink if I run 5kms daily?,mani liter water drink run km daili
465,"Where does the water from the Great Lakes come from, and how does these lakes wildlife compare to Lake Prespa?",water great lake come lake wildlif compar lake prespa
466,"Where does the water from the Great Lakes come from, and how does these lakes wildlife compare to Lake Como?",water great lake come lake wildlif compar lake como
467,Do porn stars watch porn?,porn star watch porn
468,How can I book Ronda Rousey to star in an adult movie?,book ronda rousey star adult movi
469,"Trump supporters, how do you feel about the way he's walking back his promises?",trump support feel way 's walk back promis
470,Do Trump supporters now expect the president to live up to his promises he so forcefully sold them on?,trump support expect presid live promis forc sold
471,Why are we worried about others' opinions?,worri other opinion
472,Why do we care for others' opinion and about what others think about us?,care other opinion other think u
473,How do you potty train a 4 months Pitbull?,potti train month pitbul
474,How do I potty train my two-month-old Labrador pup?,potti train two-month-old labrador pup
475,"If I jump rope for five minutes, how many calories will I use?",jump rope five minut mani calori use
476,What's the best way to jump rope?,'s best way jump rope
477,Which online test series is best for GATE 2017 in CS stream?,onlin test seri best gate c stream
478,Which test series is the best for GATE computer science stream?,test seri best gate comput scienc stream
479,What is the best material for understanding algorithmic analysis by a newbie?,best materi understand algorithm analysi newbi
480,What math does a complete newbie need to understand algorithms for computer programming? What books on algorithms are suitable for a complete beginner?,math complet newbi need understand algorithm comput program book algorithm suitabl complet beginn
481,What is the temperament of a Bullmastiff/Husky mix?,tempera bullmastiff/huski mix
482,What is the temperament of a Corgi-Husky mix?,tempera corgi-huski mix
483,"There are 8 balls. 7 of them weigh the same. 1 of them has a different weight, (you don't know if it's heavier or lighter). How do you find the odd ball with 2 weighs?",ball weigh differ weight n't know 's heavier lighter find odd ball weigh
484,"How many 4 digit numbers can be formed by using 0, 1, 2, 3, 4, 5, 6, and 7? How many of them are between 4000 and 6000?",mani digit number form use mani
485,"In the play ""A Raisin in the Sun"", why do Walter ad Beneatha argue?",play `` raisin sun '' walter ad beneatha argu
486,"In ""A Raisin in the Sun"", why do Walter and Beneatha argue?",`` raisin sun '' walter beneatha argu
487,What are the signs of an ultra smart person playing dumb?,sign ultra smart person play dumb
488,What are signs of ultra smart people hiding their intelligence?,sign ultra smart peopl hide intellig
489,If dark energy is created with expansion can infinite of it be created?,dark energi creat expans infinit creat
490,"If energy is not conserved in an expanding universe, is potential energy infinite (the energy that can be created is infinite)?",energi conserv expand univers potenti energi infinit energi creat infinit
491,How do you get a book published?,get book publish
492,What are the good ways to write and publish a book?,good way write publish book
494,Who will disrupt Bloomberg?,disrupt bloomberg
495,Why can flash run so fast?,flash run fast
496,The Flash (DC character): How fast can the Flash run a mile?,flash dc charact fast flash run mile
497,"What is the best way to invest $500 legally so that I can get tangible profits over a relatively short period of time, say 6 months?",best way invest legal get tangibl profit rel short period time say month
498,How can I best invest ₹5000 over the next 6 months?,best invest ₹ next month
499,How will the implementation of GST bill impact the lives of common people?,implement gst bill impact live common peopl
500,What exactly is GST bill and how exactly will it affect the common people?,exactli gst bill exactli affect common peopl
501,How can you recover your Gmail password?,recov gmail password
502,"I do not remember my password to my Gmail account, how can I recover my account?",rememb password gmail account recov account
503,How accurately can a mental illness can be diagnosed?,accur mental ill diagnos
504,How can I accurately diagnose and medicate my mental illness?,accur diagnos medic mental ill
505,Is knee pain in a 20 year old girl normal?,knee pain year old girl normal
506,Is it normal for a 14 year old girl to be spitting up blood?,normal year old girl spit blood
507,What are the qualities of a good leader?,qualiti good leader
508,What are some good qualities of a leader?,good qualiti leader
509,"What is the difference between bay, gulf and straits?",differ bay gulf strait
510,What exactly is the difference between a sea and a bay?,exactli differ sea bay
511,Will Modi win in 2019?,modi win
512,Can Narendra Modi become Prime Minister of India in 2019?,narendra modi becom prime minist india
513,How can I open DMart store in India? Is there any franchise for that?,open dmart store india franchis
514,How do I get reliance digital store franchise?,get relianc digit store franchis
515,What are the best YouTube channels to learn medicine?,best youtub channel learn medicin
516,What are some of the best YouTube channels for learning Git?,best youtub channel learn git
517,Did Swami Vivekananda ever eat non-veg or egg during his journey around the world?,swami vivekananda ever eat non-veg egg journey around world
518,Why don't most of the Hindus eat non-veg?,n't hindu eat non-veg
519,What will happen if I cancel TQWL tickets before the charting is done?,happen cancel tqwl ticket chart done
520,Can we cancel a 'Tatkal waiting list' ticket?,cancel 'tatkal wait list ticket
521,"What exactly is the ""Common Core Initiative/Standards"" and what are the pros and cons?",exactli `` common core initiative/standard '' pro con
522,What are the pros and cons of the Common Core Standards Initiative?,pro con common core standard initi
523,How do I choose a journal to publish my paper?,choos journal publish paper
524,Where do I publish my paper?,publish paper
525,What are your New Year's resolutions for 2017?,new year 's resolut
526,What is your creative New Year's resolution for 2017?,creativ new year 's resolut
527,What do you do if you had a bad dream?,bad dream
528,How do you not get bad dreams?,get bad dream
529,Do squats work for men?,squat work men
530,How many marks should I score for AIIMS rank 151?,mani mark score aiim rank
531,What minimum marks should I score to get among top 50 in AIIMS?,minimum mark score get among top aiim
532,"In an operating room, when two surgeons of equal experience disagree on a surgical procedure, how is the tie broken?",oper room two surgeon equal experi disagre surgic procedur tie broken
